<xs:schema xmlns:xs="http://www.w3.org/2001/XMLSchema">
    <xs:element name="schedule">
        <xs:annotation>
            <xs:documentation>Schedule is the root element.</xs:documentation>
        </xs:annotation>
        <xs:complexType>
            <xs:sequence>
                <xs:element name="course" minOccurs="0" maxOccurs="unbounded">
                    <xs:complexType>
                        <xs:sequence>
                            <xs:element name="programIdentifier">
                                <xs:simpleType>
                                    <xs:restriction base="xs:string">
                                        <xs:minLength value="4" />
                                    </xs:restriction>
                                </xs:simpleType>
                            </xs:element>
                            <xs:element name="number">
                                <xs:simpleType>
                                    <xs:restriction base="xs:nonNegativeInteger" />
                                </xs:simpleType>
                            </xs:element>
                            <xs:element name="title">
                                <xs:simpleType>
                                    <xs:restriction base="xs:string">
                                        <xs:minLength value="1" />
                                    </xs:restriction>
                                </xs:simpleType>
                            </xs:element>
                            <xs:element name="credit">
                                <xs:simpleType>
																	<xs:restriction base="xs:nonNegativeInteger" />
                                </xs:simpleType>
                            </xs:element>
                            <xs:element name="prerequisite">
                                <xs:simpleType>
                                    <xs:restriction base="xs:string">
                                        <xs:minLength value="0" />
                                    </xs:restriction>
                                </xs:simpleType>
                            </xs:element>
                            <xs:element name="description">
                                <xs:simpleType>
                                    <xs:restriction base="xs:string">
                                        <xs:minLength value="1" />
                                    </xs:restriction>
                                </xs:simpleType>
                            </xs:element>
                            <xs:element name="section" minOccurs="1" maxOccurs="unbounded">
                                <xs:complexType>
                                    <xs:sequence>
                                        <xs:element name="sectionNumber">
                                            <xs:simpleType>
                                                <xs:restriction base="xs:string">
                                                    <xs:minLength value="2" />
                                                </xs:restriction>
                                            </xs:simpleType>
                                        </xs:element>
                                        <xs:element name="instructor">
                                            <xs:simpleType>
                                                <xs:restriction base="xs:string">
                                                    <xs:minLength value="2" />
                                                </xs:restriction>
                                            </xs:simpleType>
                                        </xs:element>
                                        <xs:element name="classNumber">
                                            <xs:simpleType>
																							<xs:restriction base="xs:nonNegativeInteger" />
                                            </xs:simpleType>
                                        </xs:element>
                                        <xs:element name="room">
                                            <xs:simpleType>
                                                <xs:restriction base="xs:string">
                                                    <xs:minLength value="2" />
                                                </xs:restriction>
                                            </xs:simpleType>
                                        </xs:element>
                                        <xs:element name="days">
                                            <xs:simpleType>
                                                <xs:restriction base="xs:string">
                                                    <xs:minLength value="2" />
                                                </xs:restriction>
                                            </xs:simpleType>
                                        </xs:element>
                                        <xs:element name="startTime">
                                            <xs:simpleType>
                                                <xs:restriction base="xs:string">
                                                    <xs:minLength value="2" />
                                                </xs:restriction>
                                            </xs:simpleType>
                                        </xs:element>
                                        <xs:element name="endTime">
                                            <xs:simpleType>
                                                <xs:restriction base="xs:string">
                                                    <xs:minLength value="2" />
                                                </xs:restriction>
                                            </xs:simpleType>
                                        </xs:element>
                                        <xs:element name="status">
                                            <xs:simpleType>
                                                <xs:restriction base="xs:string">
                                                    <xs:minLength value="2" />
                                                </xs:restriction>
                                            </xs:simpleType>
                                        </xs:element>
                                    </xs:sequence>
                                </xs:complexType>
                            </xs:element>
                        </xs:sequence>
                    </xs:complexType>
                </xs:element>
            </xs:sequence>
						<xs:attribute name="year" type="xs:gYear" use="required" />
						<xs:attribute name="semester" type="xs:string" use="required" />
        </xs:complexType>
    </xs:element>
</xs:schema>
